hmm_runners/matmul.log
{"input": ["cuda", "logsummul", [512, 256, 262144, "float32"], {}], "config": {"index": 240, "code_hash": null, "entity": [["y_bn", "ot", 32], ["x_bn", "ot", 128], ["y_t", "ot", 64], ["x_t", "ot", 2], ["k_split", "ot", 8]]}, "result": [[0.6254627542, 0.6212796616], 0, 9.388461112976074, 1611882948.5217814], "version": 0.2, "tvm_version": "0.7.dev1"}
{"input": ["cuda", "logsummul", [512, 256, 262144, "float32"], {}], "config": {"index": 23, "code_hash": null, "entity": [["y_bn", "ot", 128], ["x_bn", "ot", 64], ["y_t", "ot", 64], ["x_t", "ot", 2], ["k_split", "ot", 1]]}, "result": [[0.0460469348, 0.0459423382], 0, 2.9606573581695557, 1611882949.6317906], "version": 0.2, "tvm_version": "0.7.dev1"}
{"input": ["cuda", "logsummul", [512, 256, 262144, "float32"], {}], "config": {"index": 406, "code_hash": null, "entity": [["y_bn", "ot", 64], ["x_bn", "ot", 32], ["y_t", "ot", 8], ["x_t", "ot", 32], ["k_split", "ot", 16]]}, "result": [[0.0451889132, 0.0451174374], 0, 3.1671900749206543, 1611882950.6679761], "version": 0.2, "tvm_version": "0.7.dev1"}
{"input": ["cuda", "logsummul", [512, 256, 262144, "float32"], {}], "config": {"index": 44, "code_hash": null, "entity": [["y_bn", "ot", 128], ["x_bn", "ot", 128], ["y_t", "ot", 32], ["x_t", "ot", 4], ["k_split", "ot", 1]]}, "result": [[0.0855703144, 0.08551536779999999], 0, 4.017740726470947, 1611882952.3550134], "version": 0.2, "tvm_version": "0.7.dev1"}
{"input": ["cuda", "logsummul", [512, 256, 262144, "float32"], {}], "config": {"index": 57, "code_hash": null, "entity": [["y_bn", "ot", 32], ["x_bn", "ot", 64], ["y_t", "ot", 8], ["x_t", "ot", 8], ["k_split", "ot", 1]]}, "result": [[0.0790413118, 0.0789047982], 0, 3.763218879699707, 1611882953.8001568], "version": 0.2, "tvm_version": "0.7.dev1"}
{"input": ["cuda", "logsummul", [512, 256, 262144, "float32"], {}], "config": {"index": 301, "code_hash": null, "entity": [["y_bn", "ot", 64], ["x_bn", "ot", 64], ["y_t", "ot", 8], ["x_t", "ot", 32], ["k_split", "ot", 8]]}, "result": [[0.0684317144, 0.066601976], 0, 3.5200769901275635, 1611882957.5300214], "version": 0.2, "tvm_version": "0.7.dev1"}
{"input": ["cuda", "logsummul", [512, 256, 262144, "float32"], {}], "config": {"index": 383, "code_hash": null, "entity": [["y_bn", "ot", 128], ["x_bn", "ot", 64], ["y_t", "ot", 8], ["x_t", "ot", 8], ["k_split", "ot", 16]]}, "result": [[0.07088491799999999, 0.0709396464], 0, 3.4280636310577393, 1611882959.11264], "version": 0.2, "tvm_version": "0.7.dev1"}
{"input": ["cuda", "logsummul", [512, 256, 262144, "float32"], {}], "config": {"index": 253, "code_hash": null, "entity": [["y_bn", "ot", 64], ["x_bn", "ot", 32], ["y_t", "ot", 32], ["x_t", "ot", 4], ["k_split", "ot", 8]]}, "result": [[0.0804206494, 0.08041407980000001], 0, 3.5441248416900635, 1611882960.5702848], "version": 0.2, "tvm_version": "0.7.dev1"}
{"input": ["cuda", "logsummul", [512, 256, 262144, "float32"], {}], "config": {"index": 392, "code_hash": null, "entity": [["y_bn", "ot", 128], ["x_bn", "ot", 64], ["y_t", "ot", 32], ["x_t", "ot", 8], ["k_split", "ot", 16]]}, "result": [[0.0765978532, 0.07659808380000001], 0, 3.1534640789031982, 1611882962.0122511], "version": 0.2, "tvm_version": "0.7.dev1"}
{"input": ["cuda", "logsummul", [512, 256, 262144, "float32"], {}], "config": {"index": 307, "code_hash": null, "entity": [["y_bn", "ot", 64], ["x_bn", "ot", 32], ["y_t", "ot", 32], ["x_t", "ot", 32], ["k_split", "ot", 8]]}, "result": [[0.06972323080000001, 0.0697908156], 0, 3.4564385414123535, 1611882963.3072164], "version": 0.2, "tvm_version": "0.7.dev1"}
{"input": ["cuda", "logsummul", [512, 256, 262144, "float32"], {}], "config": {"index": 203, "code_hash": null, "entity": [["y_bn", "ot", 128], ["x_bn", "ot", 64], ["y_t", "ot", 32], ["x_t", "ot", 32], ["k_split", "ot", 2]]}, "result": [[0.06454765180000001, 0.06258165460000001], 0, 3.4214141368865967, 1611885171.460396], "version": 0.2, "tvm_version": "0.7.dev1"}
{"input": ["cuda", "logsummul", [512, 256, 262144, "float32"], {}], "config": {"index": 177, "code_hash": null, "entity": [["y_bn", "ot", 32], ["x_bn", "ot", 128], ["y_t", "ot", 32], ["x_t", "ot", 8], ["k_split", "ot", 2]]}, "result": [[0.274006947, 0.2739713212], 0, 5.718620777130127, 1611885175.0351138], "version": 0.2, "tvm_version": "0.7.dev1"}
{"input": ["cuda", "logsummul", [512, 256, 262144, "float32"], {}], "config": {"index": 409, "code_hash": null, "entity": [["y_bn", "ot", 64], ["x_bn", "ot", 64], ["y_t", "ot", 8], ["x_t", "ot", 32], ["k_split", "ot", 16]]}, "result": [[0.108564149, 0.1085080544], 0, 3.9480268955230713, 1611885176.7784061], "version": 0.2, "tvm_version": "0.7.dev1"}
{"input": ["cuda", "logsummul", [512, 256, 262144, "float32"], {}], "config": {"index": 280, "code_hash": null, "entity": [["y_bn", "ot", 64], ["x_bn", "ot", 32], ["y_t", "ot", 32], ["x_t", "ot", 8], ["k_split", "ot", 8]]}, "result": [[0.136061498, 0.136053614], 0, 4.208745241165161, 1611885178.8536065], "version": 0.2, "tvm_version": "0.7.dev1"}
{"input": ["cuda", "logsummul", [512, 256, 262144, "float32"], {}], "config": {"index": 247, "code_hash": null, "entity": [["y_bn", "ot", 64], ["x_bn", "ot", 64], ["y_t", "ot", 8], ["x_t", "ot", 4], ["k_split", "ot", 8]]}, "result": [[0.07421556160000001, 0.0742109446], 0, 4.135698318481445, 1611885180.4342313], "version": 0.2, "tvm_version": "0.7.dev1"}
{"input": ["cuda", "logsummul", [512, 256, 262144, "float32"], {}], "config": {"index": 138, "code_hash": null, "entity": [["y_bn", "ot", 32], ["x_bn", "ot", 64], ["y_t", "ot", 8], ["x_t", "ot", 4], ["k_split", "ot", 2]]}, "result": [[0.0725154606, 0.069178319], 0, 3.642587423324585, 1611885184.3652852], "version": 0.2, "tvm_version": "0.7.dev1"}
{"input": ["cuda", "logsummul", [512, 256, 262144, "float32"], {}], "config": {"index": 415, "code_hash": null, "entity": [["y_bn", "ot", 64], ["x_bn", "ot", 32], ["y_t", "ot", 32], ["x_t", "ot", 32], ["k_split", "ot", 16]]}, "result": [[0.0848132142, 0.0848095582], 0, 3.8037712574005127, 1611885185.8942657], "version": 0.2, "tvm_version": "0.7.dev1"}
{"input": ["cuda", "logsummul", [512, 256, 262144, "float32"], {}], "config": {"index": 392, "code_hash": null, "entity": [["y_bn", "ot", 128], ["x_bn", "ot", 64], ["y_t", "ot", 32], ["x_t", "ot", 8], ["k_split", "ot", 16]]}, "result": [[0.076606798, 0.0765984246], 0, 3.2583303451538086, 1611885187.1915994], "version": 0.2, "tvm_version": "0.7.dev1"}
{"input": ["cuda", "logsummul", [512, 256, 262144, "float32"], {}], "config": {"index": 13, "code_hash": null, "entity": [["y_bn", "ot", 64], ["x_bn", "ot", 64], ["y_t", "ot", 32], ["x_t", "ot", 2], ["k_split", "ot", 1]]}, "result": [[0.053295462599999996, 0.053359664200000004], 0, 3.1755523681640625, 1611885188.3885703], "version": 0.2, "tvm_version": "0.7.dev1"}
{"input": ["cuda", "logsummul", [512, 256, 262144, "float32"], {}], "config": {"index": 308, "code_hash": null, "entity": [["y_bn", "ot", 128], ["x_bn", "ot", 32], ["y_t", "ot", 32], ["x_t", "ot", 32], ["k_split", "ot", 8]]}, "result": [[0.0565210124, 0.056515985199999993], 0, 3.5265886783599854, 1611885189.5922468], "version": 0.2, "tvm_version": "0.7.dev1"}
{"input": ["cuda", "logsummul", [256, 256, 262144, "float32"], {}], "config": {"index": 337, "code_hash": null, "entity": [["y_bn", "ot", 64], ["x_bn", "ot", 64], ["y_t", "ot", 32], ["x_t", "ot", 2], ["k_split", "ot", 16]]}, "result": [[0.0366806628, 0.026980130600000003], 0, 2.812021255493164, 1611894679.104123], "version": 0.2, "tvm_version": "0.7.dev1"}
{"input": ["cuda", "logsummul", [256, 256, 262144, "float32"], {}], "config": {"index": 182, "code_hash": null, "entity": [["y_bn", "ot", 128], ["x_bn", "ot", 32], ["y_t", "ot", 64], ["x_t", "ot", 8], ["k_split", "ot", 2]]}, "result": [[0.030792064600000002, 0.0308308032], 0, 2.5980398654937744, 1611894679.9856603], "version": 0.2, "tvm_version": "0.7.dev1"}
{"input": ["cuda", "logsummul", [256, 256, 262144, "float32"], {}], "config": {"index": 339, "code_hash": null, "entity": [["y_bn", "ot", 32], ["x_bn", "ot", 128], ["y_t", "ot", 32], ["x_t", "ot", 2], ["k_split", "ot", 16]]}, "result": [[0.0363859574, 0.0363945212], 0, 3.2903454303741455, 1611894681.1717436], "version": 0.2, "tvm_version": "0.7.dev1"}
{"input": ["cuda", "logsummul", [256, 256, 262144, "float32"], {}], "config": {"index": 225, "code_hash": null, "entity": [["y_bn", "ot", 32], ["x_bn", "ot", 32], ["y_t", "ot", 32], ["x_t", "ot", 2], ["k_split", "ot", 8]]}, "result": [[0.0327570284, 0.032691685], 0, 3.1245176792144775, 1611894682.1422794], "version": 0.2, "tvm_version": "0.7.dev1"}
{"input": ["cuda", "logsummul", [256, 256, 262144, "float32"], {}], "config": {"index": 148, "code_hash": null, "entity": [["y_bn", "ot", 64], ["x_bn", "ot", 64], ["y_t", "ot", 32], ["x_t", "ot", 4], ["k_split", "ot", 2]]}, "result": [[0.040037629000000005, 0.0400224418], 0, 3.1318016052246094, 1611894683.1611085], "version": 0.2, "tvm_version": "0.7.dev1"}
{"input": ["cuda", "logsummul", [256, 256, 262144, "float32"], {}], "config": {"index": 264, "code_hash": null, "entity": [["y_bn", "ot", 32], ["x_bn", "ot", 64], ["y_t", "ot", 64], ["x_t", "ot", 4], ["k_split", "ot", 8]]}, "result": [[0.135961202, 0.1325868522], 0, 4.046554327011108, 1611894687.4027767], "version": 0.2, "tvm_version": "0.7.dev1"}
{"input": ["cuda", "logsummul", [256, 256, 262144, "float32"], {}], "config": {"index": 10, "code_hash": null, "entity": [["y_bn", "ot", 64], ["x_bn", "ot", 32], ["y_t", "ot", 32], ["x_t", "ot", 2], ["k_split", "ot", 1]]}, "result": [[0.030628217800000003, 0.0306309358], 0, 2.735295295715332, 1611894688.3681364], "version": 0.2, "tvm_version": "0.7.dev1"}
{"input": ["cuda", "logsummul", [256, 256, 262144, "float32"], {}], "config": {"index": 190, "code_hash": null, "entity": [["y_bn", "ot", 64], ["x_bn", "ot", 32], ["y_t", "ot", 8], ["x_t", "ot", 32], ["k_split", "ot", 2]]}, "result": [[0.0351383278, 0.0350610734], 0, 2.9343314170837402, 1611894689.3294647], "version": 0.2, "tvm_version": "0.7.dev1"}
{"input": ["cuda", "logsummul", [256, 256, 262144, "float32"], {}], "config": {"index": 43, "code_hash": null, "entity": [["y_bn", "ot", 64], ["x_bn", "ot", 128], ["y_t", "ot", 32], ["x_t", "ot", 4], ["k_split", "ot", 1]]}, "result": [[0.044394967, 0.0443845142], 0, 3.0456857681274414, 1611894690.4542456], "version": 0.2, "tvm_version": "0.7.dev1"}
{"input": ["cuda", "logsummul", [256, 256, 262144, "float32"], {}], "config": {"index": 254, "code_hash": null, "entity": [["y_bn", "ot", 128], ["x_bn", "ot", 32], ["y_t", "ot", 32], ["x_t", "ot", 4], ["k_split", "ot", 8]]}, "result": [[0.0364682126, 0.0315127234], 0, 2.6694390773773193, 1611895735.0704372], "version": 0.2, "tvm_version": "0.7.dev1"}
{"input": ["cuda", "logsummul", [256, 256, 262144, "float32"], {}], "config": {"index": 132, "code_hash": null, "entity": [["y_bn", "ot", 32], ["x_bn", "ot", 128], ["y_t", "ot", 64], ["x_t", "ot", 2], ["k_split", "ot", 2]]}, "result": [[0.3542294704, 0.353124545], 0, 6.2843499183654785, 1611895739.537598], "version": 0.2, "tvm_version": "0.7.dev1"}
{"input": ["cuda", "logsummul", [256, 256, 262144, "float32"], {}], "config": {"index": 258, "code_hash": null, "entity": [["y_bn", "ot", 32], ["x_bn", "ot", 128], ["y_t", "ot", 32], ["x_t", "ot", 4], ["k_split", "ot", 8]]}, "result": [[0.0689822664, 0.0689338528], 0, 3.0231590270996094, 1611895740.9026527], "version": 0.2, "tvm_version": "0.7.dev1"}
{"input": ["cuda", "logsummul", [256, 256, 262144, "float32"], {}], "config": {"index": 193, "code_hash": null, "entity": [["y_bn", "ot", 64], ["x_bn", "ot", 64], ["y_t", "ot", 8], ["x_t", "ot", 32], ["k_split", "ot", 2]]}, "result": [[0.0241109578, 0.024226700400000002], 0, 2.5362539291381836, 1611895741.7378361], "version": 0.2, "tvm_version": "0.7.dev1"}
{"input": ["cuda", "logsummul", [256, 256, 262144, "float32"], {}], "config": {"index": 175, "code_hash": null, "entity": [["y_bn", "ot", 64], ["x_bn", "ot", 64], ["y_t", "ot", 32], ["x_t", "ot", 8], ["k_split", "ot", 2]]}, "result": [[0.0488957718, 0.040956958599999996], 0, 3.1328587532043457, 1611895745.575973], "version": 0.2, "tvm_version": "0.7.dev1"}
{"input": ["cuda", "logsummul", [256, 256, 262144, "float32"], {}], "config": {"index": 165, "code_hash": null, "entity": [["y_bn", "ot", 32], ["x_bn", "ot", 64], ["y_t", "ot", 8], ["x_t", "ot", 8], ["k_split", "ot", 2]]}, "result": [[0.033672432200000005, 0.0337693766], 0, 2.6050126552581787, 1611895746.5383844], "version": 0.2, "tvm_version": "0.7.dev1"}
{"input": ["cuda", "logsummul", [256, 256, 262144, "float32"], {}], "config": {"index": 243, "code_hash": null, "entity": [["y_bn", "ot", 32], ["x_bn", "ot", 32], ["y_t", "ot", 8], ["x_t", "ot", 4], ["k_split", "ot", 8]]}, "result": [[0.0365799672, 0.036566471], 0, 2.621795892715454, 1611895747.5386922], "version": 0.2, "tvm_version": "0.7.dev1"}
{"input": ["cuda", "logsummul", [256, 256, 262144, "float32"], {}], "config": {"index": 275, "code_hash": null, "entity": [["y_bn", "ot", 128], ["x_bn", "ot", 64], ["y_t", "ot", 8], ["x_t", "ot", 8], ["k_split", "ot", 8]]}, "result": [[0.0354907098, 0.0354646816], 0, 3.117626905441284, 1611895748.6292014], "version": 0.2, "tvm_version": "0.7.dev1"}
{"input": ["cuda", "logsummul", [256, 256, 262144, "float32"], {}], "config": {"index": 143, "code_hash": null, "entity": [["y_bn", "ot", 128], ["x_bn", "ot", 128], ["y_t", "ot", 8], ["x_t", "ot", 4], ["k_split", "ot", 2]]}, "result": [[0.671005568, 0.6718135411999999], 0, 10.644513368606567, 1611895756.6841586], "version": 0.2, "tvm_version": "0.7.dev1"}
{"input": ["cuda", "logsummul", [256, 256, 262144, "float32"], {}], "config": {"index": 129, "code_hash": null, "entity": [["y_bn", "ot", 32], ["x_bn", "ot", 64], ["y_t", "ot", 64], ["x_t", "ot", 2], ["k_split", "ot", 2]]}, "result": [[0.08633386159999999, 0.08037619780000001], 0, 3.272639274597168, 1611896220.4546447], "version": 0.2, "tvm_version": "0.7.dev1"}
{"input": ["cuda", "logsummul", [256, 256, 262144, "float32"], {}], "config": {"index": 84, "code_hash": null, "entity": [["y_bn", "ot", 32], ["x_bn", "ot", 64], ["y_t", "ot", 8], ["x_t", "ot", 32], ["k_split", "ot", 1]]}, "result": [[0.0578317226, 0.057751052000000004], 0, 2.983639717102051, 1611896221.6131313], "version": 0.2, "tvm_version": "0.7.dev1"}
{"input": ["cuda", "logsummul", [256, 256, 262144, "float32"], {}], "config": {"index": 147, "code_hash": null, "entity": [["y_bn", "ot", 32], ["x_bn", "ot", 64], ["y_t", "ot", 32], ["x_t", "ot", 4], ["k_split", "ot", 2]]}, "result": [[0.0748027232, 0.074774558], 0, 3.4370455741882324, 1611896222.9865348], "version": 0.2, "tvm_version": "0.7.dev1"}
{"input": ["cuda", "logsummul", [256, 256, 262144, "float32"], {}], "config": {"index": 112, "code_hash": null, "entity": [["y_bn", "ot", 64], ["x_bn", "ot", 64], ["y_t", "ot", 8], ["x_t", "ot", 2], ["k_split", "ot", 2]]}, "result": [[0.6484618556, 0.6486799010000001], 0, 10.437540054321289, 1611896230.86275], "version": 0.2, "tvm_version": "0.7.dev1"}
{"input": ["cuda", "logsummul", [256, 256, 262144, "float32"], {}], "config": {"index": 50, "code_hash": null, "entity": [["y_bn", "ot", 128], ["x_bn", "ot", 64], ["y_t", "ot", 64], ["x_t", "ot", 4], ["k_split", "ot", 1]]}, "result": [[0.029872532400000002, 0.0298317638], 0, 2.9303457736968994, 1611896231.7427554], "version": 0.2, "tvm_version": "0.7.dev1"}
{"input": ["cuda", "logsummul", [256, 256, 262144, "float32"], {}], "config": {"index": 0, "code_hash": null, "entity": [["y_bn", "ot", 32], ["x_bn", "ot", 32], ["y_t", "ot", 8], ["x_t", "ot", 2], ["k_split", "ot", 1]]}, "result": [[0.0509153094, 0.0404116572], 0, 2.7638771533966064, 1611896235.0666277], "version": 0.2, "tvm_version": "0.7.dev1"}
{"input": ["cuda", "logsummul", [256, 256, 262144, "float32"], {}], "config": {"index": 33, "code_hash": null, "entity": [["y_bn", "ot", 32], ["x_bn", "ot", 128], ["y_t", "ot", 8], ["x_t", "ot", 4], ["k_split", "ot", 1]]}, "result": [[0.052451624399999994, 0.052589244], 0, 3.0361249446868896, 1611896236.4211473], "version": 0.2, "tvm_version": "0.7.dev1"}
{"input": ["cuda", "logsummul", [256, 256, 262144, "float32"], {}], "config": {"index": 359, "code_hash": null, "entity": [["y_bn", "ot", 128], ["x_bn", "ot", 128], ["y_t", "ot", 8], ["x_t", "ot", 4], ["k_split", "ot", 16]]}, "result": [[0.6451578728, 0.6451039646], 0, 9.754483222961426, 1611896244.136176], "version": 0.2, "tvm_version": "0.7.dev1"}
{"input": ["cuda", "logsummul", [256, 256, 262144, "float32"], {}], "config": {"index": 144, "code_hash": null, "entity": [["y_bn", "ot", 32], ["x_bn", "ot", 32], ["y_t", "ot", 32], ["x_t", "ot", 4], ["k_split", "ot", 2]]}, "result": [[0.0497919632, 0.0498408152], 0, 2.6467678546905518, 1611896245.196221], "version": 0.2, "tvm_version": "0.7.dev1"}
{"input": ["cuda", "logsummul", [256, 512, 262144, "float32"], {}], "config": {"index": 268, "code_hash": null, "entity": [["y_bn", "ot", 64], ["x_bn", "ot", 128], ["y_t", "ot", 64], ["x_t", "ot", 4], ["k_split", "ot", 8]]}, "result": [[0.1297236504, 0.1306050386], 0, 3.06204891204834, 1611966820.7579863], "version": 0.2, "tvm_version": "0.7.dev1"}
{"input": ["cuda", "logsummul", [256, 512, 262144, "float32"], {}], "config": {"index": 145, "code_hash": null, "entity": [["y_bn", "ot", 64], ["x_bn", "ot", 32], ["y_t", "ot", 32], ["x_t", "ot", 4], ["k_split", "ot", 2]]}, "result": [[0.0595367448, 0.05947216600000001], 0, 2.165353775024414, 1611966822.037944], "version": 0.2, "tvm_version": "0.7.dev1"}
{"input": ["cuda", "logsummul", [256, 512, 262144, "float32"], {}], "config": {"index": 285, "code_hash": null, "entity": [["y_bn", "ot", 32], ["x_bn", "ot", 128], ["y_t", "ot", 32], ["x_t", "ot", 8], ["k_split", "ot", 8]]}, "result": [[0.2518735532, 0.251864518], 0, 4.224450349807739, 1611966825.419951], "version": 0.2, "tvm_version": "0.7.dev1"}
{"input": ["cuda", "logsummul", [256, 512, 262144, "float32"], {}], "config": {"index": 97, "code_hash": null, "entity": [["y_bn", "ot", 64], ["x_bn", "ot", 128], ["y_t", "ot", 32], ["x_t", "ot", 32], ["k_split", "ot", 1]]}, "result": [[0.0828117598, 0.0827375478], 0, 2.536992073059082, 1611966826.8984065], "version": 0.2, "tvm_version": "0.7.dev1"}
{"input": ["cuda", "logsummul", [256, 512, 262144, "float32"], {}], "config": {"index": 354, "code_hash": null, "entity": [["y_bn", "ot", 32], ["x_bn", "ot", 64], ["y_t", "ot", 8], ["x_t", "ot", 4], ["k_split", "ot", 16]]}, "result": [[0.055922113399999994, 0.05594423080000001], 0, 2.6984431743621826, 1611966828.2819824], "version": 0.2, "tvm_version": "0.7.dev1"}
{"input": ["cuda", "logsummul", [256, 512, 262144, "float32"], {}], "config": {"index": 239, "code_hash": null, "entity": [["y_bn", "ot", 128], ["x_bn", "ot", 64], ["y_t", "ot", 64], ["x_t", "ot", 2], ["k_split", "ot", 8]]}, "result": [[0.055734664, 0.0428809306], 0, 2.0604095458984375, 1611966830.54421], "version": 0.2, "tvm_version": "0.7.dev1"}
{"input": ["cuda", "logsummul", [256, 512, 262144, "float32"], {}], "config": {"index": 234, "code_hash": null, "entity": [["y_bn", "ot", 32], ["x_bn", "ot", 32], ["y_t", "ot", 64], ["x_t", "ot", 2], ["k_split", "ot", 8]]}, "result": [[0.18506002059999999, 0.18499889519999999], 0, 3.446366310119629, 1611966833.1586397], "version": 0.2, "tvm_version": "0.7.dev1"}
{"input": ["cuda", "logsummul", [256, 512, 262144, "float32"], {}], "config": {"index": 252, "code_hash": null, "entity": [["y_bn", "ot", 32], ["x_bn", "ot", 32], ["y_t", "ot", 32], ["x_t", "ot", 4], ["k_split", "ot", 8]]}, "result": [[0.140410086, 0.1404234134], 0, 2.874619483947754, 1611966835.2832391], "version": 0.2, "tvm_version": "0.7.dev1"}
{"input": ["cuda", "logsummul", [256, 512, 262144, "float32"], {}], "config": {"index": 298, "code_hash": null, "entity": [["y_bn", "ot", 64], ["x_bn", "ot", 32], ["y_t", "ot", 8], ["x_t", "ot", 32], ["k_split", "ot", 8]]}, "result": [[0.050626288, 0.0422303004], 0, 3.2798783779144287, 1612200641.3799834], "version": 0.2, "tvm_version": "0.7.dev1"}
{"input": ["cuda", "logsummul", [256, 512, 262144, "float32"], {}], "config": {"index": 354, "code_hash": null, "entity": [["y_bn", "ot", 32], ["x_bn", "ot", 64], ["y_t", "ot", 8], ["x_t", "ot", 4], ["k_split", "ot", 16]]}, "result": [[0.8501870692000001, 0.8504017094], 0, 12.632222175598145, 1612200651.334513], "version": 0.2, "tvm_version": "0.7.dev1"}
{"input": ["cuda", "logsummul", [256, 512, 262144, "float32"], {}], "config": {"index": 41, "code_hash": null, "entity": [["y_bn", "ot", 128], ["x_bn", "ot", 64], ["y_t", "ot", 32], ["x_t", "ot", 4], ["k_split", "ot", 1]]}, "result": [[0.8335424496, 0.8358546995999999], 0, 12.492846965789795, 1612200661.1619558], "version": 0.2, "tvm_version": "0.7.dev1"}
{"input": ["cuda", "logsummul", [256, 512, 262144, "float32"], {}], "config": {"index": 349, "code_hash": null, "entity": [["y_bn", "ot", 64], ["x_bn", "ot", 128], ["y_t", "ot", 64], ["x_t", "ot", 2], ["k_split", "ot", 16]]}, "result": [[1.4959420608, 1.4914181067999999], 0, 19.53466272354126, 1612200678.165117], "version": 0.2, "tvm_version": "0.7.dev1"}
{"input": ["cuda", "logsummul", [256, 512, 262144, "float32"], {}], "config": {"index": 175, "code_hash": null, "entity": [["y_bn", "ot", 64], ["x_bn", "ot", 64], ["y_t", "ot", 32], ["x_t", "ot", 8], ["k_split", "ot", 2]]}, "result": [[0.086593881, 0.0866029498], 0, 3.786107063293457, 1612200679.677219], "version": 0.2, "tvm_version": "0.7.dev1"}
{"input": ["cuda", "logsummul", [256, 512, 262144, "float32"], {}], "config": {"index": 273, "code_hash": null, "entity": [["y_bn", "ot", 32], ["x_bn", "ot", 64], ["y_t", "ot", 8], ["x_t", "ot", 8], ["k_split", "ot", 8]]}, "result": [[0.0872136476, 0.0854501944], 0, 4.042162656784058, 1612200683.888108], "version": 0.2, "tvm_version": "0.7.dev1"}
{"input": ["cuda", "logsummul", [256, 512, 262144, "float32"], {}], "config": {"index": 92, "code_hash": null, "entity": [["y_bn", "ot", 128], ["x_bn", "ot", 32], ["y_t", "ot", 32], ["x_t", "ot", 32], ["k_split", "ot", 1]]}, "result": [[0.1254983338, 0.1254614402], 0, 4.3893351554870605, 1612200685.8357918], "version": 0.2, "tvm_version": "0.7.dev1"}
{"input": ["cuda", "logsummul", [256, 512, 262144, "float32"], {}], "config": {"index": 198, "code_hash": null, "entity": [["y_bn", "ot", 32], ["x_bn", "ot", 32], ["y_t", "ot", 32], ["x_t", "ot", 32], ["k_split", "ot", 2]]}, "result": [[0.1529863614, 0.15300019], 0, 4.604793548583984, 1612200688.0634322], "version": 0.2, "tvm_version": "0.7.dev1"}
{"input": ["cuda", "logsummul", [256, 512, 262144, "float32"], {}], "config": {"index": 274, "code_hash": null, "entity": [["y_bn", "ot", 64], ["x_bn", "ot", 64], ["y_t", "ot", 8], ["x_t", "ot", 8], ["k_split", "ot", 8]]}, "result": [[0.051051954600000005, 0.051332321], 0, 3.501258611679077, 1612200689.2495286], "version": 0.2, "tvm_version": "0.7.dev1"}
{"input": ["cuda", "logsummul", [256, 512, 262144, "float32"], {}], "config": {"index": 34, "code_hash": null, "entity": [["y_bn", "ot", 64], ["x_bn", "ot", 128], ["y_t", "ot", 8], ["x_t", "ot", 4], ["k_split", "ot", 1]]}, "result": [[2.045230695, 2.0482322068], 0, 25.416021585464478, 1612200712.3277175], "version": 0.2, "tvm_version": "0.7.dev1"}
{"input": ["cuda", "logsummul", [256, 512, 262144, "float32"], {}], "config": {"index": 191, "code_hash": null, "entity": [["y_bn", "ot", 128], ["x_bn", "ot", 32], ["y_t", "ot", 8], ["x_t", "ot", 32], ["k_split", "ot", 2]]}, "result": [[0.068299784, 0.062284650799999994], 0, 3.0269651412963867, 1612200749.9878814], "version": 0.2, "tvm_version": "0.7.dev1"}
{"input": ["cuda", "logsummul", [256, 512, 262144, "float32"], {}], "config": {"index": 53, "code_hash": null, "entity": [["y_bn", "ot", 128], ["x_bn", "ot", 128], ["y_t", "ot", 64], ["x_t", "ot", 4], ["k_split", "ot", 1]]}, "result": [[1.2241302188, 1.2327661135999999], 0, 16.378445386886597, 1612200764.0820537], "version": 0.2, "tvm_version": "0.7.dev1"}
{"input": ["cuda", "logsummul", [256, 512, 262144, "float32"], {}], "config": {"index": 139, "code_hash": null, "entity": [["y_bn", "ot", 64], ["x_bn", "ot", 64], ["y_t", "ot", 8], ["x_t", "ot", 4], ["k_split", "ot", 2]]}, "result": [[0.858319671, 0.8586549828000001], 0, 12.482793092727661, 1612200774.4245915], "version": 0.2, "tvm_version": "0.7.dev1"}
{"input": ["cuda", "logsummul", [256, 512, 262144, "float32"], {}], "config": {"index": 178, "code_hash": null, "entity": [["y_bn", "ot", 64], ["x_bn", "ot", 128], ["y_t", "ot", 32], ["x_t", "ot", 8], ["k_split", "ot", 2]]}, "result": [[0.9417599856000001, 0.9422232974], 0, 13.195714473724365, 1612200785.3807008], "version": 0.2, "tvm_version": "0.7.dev1"}
{"input": ["cuda", "logsummul", [256, 512, 262144, "float32"], {}], "config": {"index": 325, "code_hash": null, "entity": [["y_bn", "ot", 64], ["x_bn", "ot", 32], ["y_t", "ot", 8], ["x_t", "ot", 2], ["k_split", "ot", 16]]}, "result": [[0.6687186488, 0.6691134774], 0, 10.420876502990723, 1612200796.0152485], "version": 0.2, "tvm_version": "0.7.dev1"}
{"input": ["cuda", "logsummul", [256, 512, 262144, "float32"], {}], "config": {"index": 123, "code_hash": null, "entity": [["y_bn", "ot", 32], ["x_bn", "ot", 128], ["y_t", "ot", 32], ["x_t", "ot", 2], ["k_split", "ot", 2]]}, "result": [[1.3358640088, 1.336073324], 0, 17.388086318969727, 1612200811.3430748], "version": 0.2, "tvm_version": "0.7.dev1"}
{"input": ["cuda", "logsummul", [256, 512, 262144, "float32"], {}], "config": {"index": 216, "code_hash": null, "entity": [["y_bn", "ot", 32], ["x_bn", "ot", 32], ["y_t", "ot", 8], ["x_t", "ot", 2], ["k_split", "ot", 8]]}, "result": [[0.0864817626, 0.0864532984], 0, 3.667767286300659, 1612200813.8110697], "version": 0.2, "tvm_version": "0.7.dev1"}
{"input": ["cuda", "logsummulback", [256, 512, 262144, "float32"], {}], "config": {"index": 79, "code_hash": null, "entity": [["y_bn", "ot", 64], ["x_bn", "ot", 128], ["y_t", "ot", 64], ["x_t", "ot", 8], ["k_split", "ot", 1]]}, "result": [[0.40885936840000003, 0.409116359], 0, 8.735087394714355, 1612200823.8625474], "version": 0.2, "tvm_version": "0.7.dev1"}
{"input": ["cuda", "logsummulback", [256, 512, 262144, "float32"], {}], "config": {"index": 267, "code_hash": null, "entity": [["y_bn", "ot", 32], ["x_bn", "ot", 128], ["y_t", "ot", 64], ["x_t", "ot", 4], ["k_split", "ot", 8]]}, "result": [[1.9171360480000001, 1.916635345], 0, 24.363157510757446, 1612200845.5181804], "version": 0.2, "tvm_version": "0.7.dev1"}
{"input": ["cuda", "logsummulback", [256, 512, 262144, "float32"], {}], "config": {"index": 337, "code_hash": null, "entity": [["y_bn", "ot", 64], ["x_bn", "ot", 64], ["y_t", "ot", 32], ["x_t", "ot", 2], ["k_split", "ot", 16]]}, "result": [[1.4210818034000001, 1.4214355314], 0, 19.594583988189697, 1612200861.8117714], "version": 0.2, "tvm_version": "0.7.dev1"}
{"input": ["cuda", "logsummulback", [256, 512, 262144, "float32"], {}], "config": {"index": 387, "code_hash": null, "entity": [["y_bn", "ot", 32], ["x_bn", "ot", 32], ["y_t", "ot", 32], ["x_t", "ot", 8], ["k_split", "ot", 16]]}, "result": [[0.0905527666, 0.0911919382], 0, 5.127631902694702, 1612200863.3863697], "version": 0.2, "tvm_version": "0.7.dev1"}
{"input": ["cuda", "logsummulback", [256, 512, 262144, "float32"], {}], "config": {"index": 97, "code_hash": null, "entity": [["y_bn", "ot", 64], ["x_bn", "ot", 128], ["y_t", "ot", 32], ["x_t", "ot", 32], ["k_split", "ot", 1]]}, "result": [[0.1800026992, 0.1800004468], 0, 5.180721759796143, 1612200865.9153938], "version": 0.2, "tvm_version": "0.7.dev1"}
{"input": ["cuda", "logsummulback", [256, 512, 262144, "float32"], {}], "config": {"index": 136, "code_hash": null, "entity": [["y_bn", "ot", 64], ["x_bn", "ot", 32], ["y_t", "ot", 8], ["x_t", "ot", 4], ["k_split", "ot", 2]]}, "result": [[0.599262012, 0.5996552902000001], 0, 10.014258623123169, 1612200876.9306948], "version": 0.2, "tvm_version": "0.7.dev1"}
{"input": ["cuda", "logsummulback", [256, 512, 262144, "float32"], {}], "config": {"index": 64, "code_hash": null, "entity": [["y_bn", "ot", 64], ["x_bn", "ot", 32], ["y_t", "ot", 32], ["x_t", "ot", 8], ["k_split", "ot", 1]]}, "result": [[0.17804686860000002, 0.178054416], 0, 5.8038177490234375, 1612200879.4600878], "version": 0.2, "tvm_version": "0.7.dev1"}
{"input": ["cuda", "logsummulback", [256, 512, 262144, "float32"], {}], "config": {"index": 96, "code_hash": null, "entity": [["y_bn", "ot", 32], ["x_bn", "ot", 128], ["y_t", "ot", 32], ["x_t", "ot", 32], ["k_split", "ot", 1]]}, "result": [[0.2116571248, 0.2116937778], 0, 6.481731653213501, 1612200882.3772283], "version": 0.2, "tvm_version": "0.7.dev1"}
{"input": ["cuda", "logsummulback", [256, 512, 262144, "float32"], {}], "config": {"index": 10, "code_hash": null, "entity": [["y_bn", "ot", 64], ["x_bn", "ot", 32], ["y_t", "ot", 32], ["x_t", "ot", 2], ["k_split", "ot", 1]]}, "result": [[0.9569401426, 0.9569797252000001], 0, 14.692742347717285, 1612200893.495666], "version": 0.2, "tvm_version": "0.7.dev1"}
{"input": ["cuda", "logsummulback", [256, 512, 262144, "float32"], {}], "config": {"index": 138, "code_hash": null, "entity": [["y_bn", "ot", 32], ["x_bn", "ot", 64], ["y_t", "ot", 8], ["x_t", "ot", 4], ["k_split", "ot", 2]]}, "result": [[0.9520455724, 0.9520552951999999], 0, 13.807166814804077, 1612200904.5986333], "version": 0.2, "tvm_version": "0.7.dev1"}
{"input": ["cuda", "logsummulback", [262144, 512, 256, "float32"], {}], "config": {"index": 274, "code_hash": null, "entity": [["y_bn", "ot", 64], ["x_bn", "ot", 64], ["y_t", "ot", 8], ["x_t", "ot", 8], ["k_split", "ot", 8]]}, "result": [[2.0610684216, 2.0611129666], 0, 26.153098106384277, 1612200932.3223245], "version": 0.2, "tvm_version": "0.7.dev1"}
{"input": ["cuda", "logsummulback", [262144, 512, 256, "float32"], {}], "config": {"index": 66, "code_hash": null, "entity": [["y_bn", "ot", 32], ["x_bn", "ot", 64], ["y_t", "ot", 32], ["x_t", "ot", 8], ["k_split", "ot", 1]]}, "result": [[0.39743511, 0.3974393102], 0, 7.850003004074097, 1612200937.2584722], "version": 0.2, "tvm_version": "0.7.dev1"}
{"input": ["cuda", "logsummulback", [262144, 512, 256, "float32"], {}], "config": {"index": 243, "code_hash": null, "entity": [["y_bn", "ot", 32], ["x_bn", "ot", 32], ["y_t", "ot", 8], ["x_t", "ot", 4], ["k_split", "ot", 8]]}, "result": [[0.9139954178, 0.9139030166], 0, 13.407808303833008, 1612200947.8698342], "version": 0.2, "tvm_version": "0.7.dev1"}
{"input": ["cuda", "logsummulback", [262144, 512, 256, "float32"], {}], "config": {"index": 293, "code_hash": null, "entity": [["y_bn", "ot", 128], ["x_bn", "ot", 64], ["y_t", "ot", 64], ["x_t", "ot", 8], ["k_split", "ot", 8]]}, "result": [[0.5850571052, 0.5850702238000001], 0, 9.923479318618774, 1612200954.8751945], "version": 0.2, "tvm_version": "0.7.dev1"}
{"input": ["cuda", "logsummulback", [262144, 512, 256, "float32"], {}], "config": {"index": 90, "code_hash": null, "entity": [["y_bn", "ot", 32], ["x_bn", "ot", 32], ["y_t", "ot", 32], ["x_t", "ot", 32], ["k_split", "ot", 1]]}, "result": [[0.33841854320000003, 0.3402009274], 0, 7.950613021850586, 1612200963.1609926], "version": 0.2, "tvm_version": "0.7.dev1"}
{"input": ["cuda", "logsummulback", [262144, 512, 256, "float32"], {}], "config": {"index": 281, "code_hash": null, "entity": [["y_bn", "ot", 128], ["x_bn", "ot", 32], ["y_t", "ot", 32], ["x_t", "ot", 8], ["k_split", "ot", 8]]}, "result": [[0.5017584038, 0.5017629258], 0, 9.666942358016968, 1612201029.651915], "version": 0.2, "tvm_version": "0.7.dev1"}
{"input": ["cuda", "logsummulback", [262144, 512, 256, "float32"], {}], "config": {"index": 127, "code_hash": null, "entity": [["y_bn", "ot", 64], ["x_bn", "ot", 32], ["y_t", "ot", 64], ["x_t", "ot", 2], ["k_split", "ot", 2]]}, "result": [[0.5999065856, 0.5998987311999999], 0, 10.884392738342285, 1612201036.8266413], "version": 0.2, "tvm_version": "0.7.dev1"}
{"input": ["cuda", "logsummul", [256, 256, 262144, "float32"], {}], "config": {"index": 400, "code_hash": null, "entity": [["y_bn", "ot", 64], ["x_bn", "ot", 64], ["y_t", "ot", 64], ["x_t", "ot", 8], ["k_split", "ot", 16]]}, "result": [[0.12920855920000002, 0.12919315380000002], 0, 4.584658861160278, 1612201103.4910002], "version": 0.2, "tvm_version": "0.7.dev1"}
{"input": ["cuda", "logsummul", [256, 256, 262144, "float32"], {}], "config": {"index": 237, "code_hash": null, "entity": [["y_bn", "ot", 32], ["x_bn", "ot", 64], ["y_t", "ot", 64], ["x_t", "ot", 2], ["k_split", "ot", 8]]}, "result": [[1.6963350782, 1.700215808], 0, 21.341543197631836, 1612201122.716383], "version": 0.2, "tvm_version": "0.7.dev1"}
{"input": ["cuda", "logsummul", [256, 256, 262144, "float32"], {}], "config": {"index": 144, "code_hash": null, "entity": [["y_bn", "ot", 32], ["x_bn", "ot", 32], ["y_t", "ot", 32], ["x_t", "ot", 4], ["k_split", "ot", 2]]}, "result": [[0.0527542934, 0.0527847532], 0, 3.2296316623687744, 1612201123.8403046], "version": 0.2, "tvm_version": "0.7.dev1"}
{"input": ["cuda", "logsummul", [256, 256, 262144, "float32"], {}], "config": {"index": 143, "code_hash": null, "entity": [["y_bn", "ot", 128], ["x_bn", "ot", 128], ["y_t", "ot", 8], ["x_t", "ot", 4], ["k_split", "ot", 2]]}, "result": [[1.0031549346, 1.0039517076], 0, 14.417850017547607, 1612201135.4767616], "version": 0.2, "tvm_version": "0.7.dev1"}
{"input": ["cuda", "logsummul", [256, 256, 262144, "float32"], {}], "config": {"index": 242, "code_hash": null, "entity": [["y_bn", "ot", 128], ["x_bn", "ot", 128], ["y_t", "ot", 64], ["x_t", "ot", 2], ["k_split", "ot", 8]]}, "result": [[0.6534568304, 0.653422229], 0, 10.617236375808716, 1612201143.4158304], "version": 0.2, "tvm_version": "0.7.dev1"}
{"input": ["cuda", "logsummul", [256, 256, 262144, "float32"], {}], "config": {"index": 405, "code_hash": null, "entity": [["y_bn", "ot", 32], ["x_bn", "ot", 32], ["y_t", "ot", 8], ["x_t", "ot", 32], ["k_split", "ot", 16]]}, "result": [[0.034250662, 0.028106187799999998], 0, 3.2004103660583496, 1612201147.162088], "version": 0.2, "tvm_version": "0.7.dev1"}
{"input": ["cuda", "logsummul", [256, 256, 262144, "float32"], {}], "config": {"index": 7, "code_hash": null, "entity": [["y_bn", "ot", 64], ["x_bn", "ot", 128], ["y_t", "ot", 8], ["x_t", "ot", 2], ["k_split", "ot", 1]]}, "result": [[1.0098184466, 1.009030179], 0, 14.540921926498413, 1612201159.1267009], "version": 0.2, "tvm_version": "0.7.dev1"}
{"input": ["cuda", "logsummul", [256, 256, 262144, "float32"], {}], "config": {"index": 194, "code_hash": null, "entity": [["y_bn", "ot", 128], ["x_bn", "ot", 64], ["y_t", "ot", 8], ["x_t", "ot", 32], ["k_split", "ot", 2]]}, "result": [[0.07429673719999999, 0.07422947939999999], 0, 3.6626081466674805, 1612201160.52385], "version": 0.2, "tvm_version": "0.7.dev1"}
{"input": ["cuda", "logsummul", [256, 256, 262144, "float32"], {}], "config": {"index": 183, "code_hash": null, "entity": [["y_bn", "ot", 32], ["x_bn", "ot", 64], ["y_t", "ot", 64], ["x_t", "ot", 8], ["k_split", "ot", 2]]}, "result": [[0.8116288667999999, 0.8130727796], 0, 11.943352222442627, 1612201170.0143144], "version": 0.2, "tvm_version": "0.7.dev1"}
{"input": ["cuda", "logsummul", [256, 256, 262144, "float32"], {}], "config": {"index": 1, "code_hash": null, "entity": [["y_bn", "ot", 64], ["x_bn", "ot", 32], ["y_t", "ot", 8], ["x_t", "ot", 2], ["k_split", "ot", 1]]}, "result": [[0.331637998, 0.3316957268], 0, 7.217077970504761, 1612201174.5381596], "version": 0.2, "tvm_version": "0.7.dev1"}
{"input": ["cuda", "logsummulback", [256, 256, 262144, "float32"], {}], "config": {"index": 91, "code_hash": null, "entity": [["y_bn", "ot", 64], ["x_bn", "ot", 32], ["y_t", "ot", 32], ["x_t", "ot", 32], ["k_split", "ot", 1]]}, "result": [[0.1315783642, 0.1286985404], 0, 5.6505351066589355, 1612201181.559906], "version": 0.2, "tvm_version": "0.7.dev1"}
{"input": ["cuda", "logsummulback", [256, 256, 262144, "float32"], {}], "config": {"index": 276, "code_hash": null, "entity": [["y_bn", "ot", 32], ["x_bn", "ot", 128], ["y_t", "ot", 8], ["x_t", "ot", 8], ["k_split", "ot", 8]]}, "result": [[0.261320589, 0.261293519], 0, 6.380816459655762, 1612201185.0105038], "version": 0.2, "tvm_version": "0.7.dev1"}
{"input": ["cuda", "logsummulback", [256, 256, 262144, "float32"], {}], "config": {"index": 79, "code_hash": null, "entity": [["y_bn", "ot", 64], ["x_bn", "ot", 128], ["y_t", "ot", 64], ["x_t", "ot", 8], ["k_split", "ot", 1]]}, "result": [[0.20602629879999998, 0.2060528636], 0, 6.184636831283569, 1612201187.8367436], "version": 0.2, "tvm_version": "0.7.dev1"}
{"input": ["cuda", "logsummulback", [256, 256, 262144, "float32"], {}], "config": {"index": 379, "code_hash": null, "entity": [["y_bn", "ot", 64], ["x_bn", "ot", 32], ["y_t", "ot", 8], ["x_t", "ot", 8], ["k_split", "ot", 16]]}, "result": [[0.20513301379999999, 0.20513070500000002], 0, 6.47325587272644, 1612201190.6356921], "version": 0.2, "tvm_version": "0.7.dev1"}
{"input": ["cuda", "logsummulback", [256, 256, 262144, "float32"], {}], "config": {"index": 243, "code_hash": null, "entity": [["y_bn", "ot", 32], ["x_bn", "ot", 32], ["y_t", "ot", 8], ["x_t", "ot", 4], ["k_split", "ot", 8]]}, "result": [[0.10724155319999999, 0.10724058460000001], 0, 4.716177225112915, 1612201192.4082391], "version": 0.2, "tvm_version": "0.7.dev1"}
{"input": ["cuda", "logsummulback", [256, 256, 262144, "float32"], {}], "config": {"index": 389, "code_hash": null, "entity": [["y_bn", "ot", 128], ["x_bn", "ot", 32], ["y_t", "ot", 32], ["x_t", "ot", 8], ["k_split", "ot", 16]]}, "result": [[0.1119916688, 0.11196843540000001], 0, 3.913351058959961, 1612201196.5126], "version": 0.2, "tvm_version": "0.7.dev1"}
{"input": ["cuda", "logsummulback", [256, 256, 262144, "float32"], {}], "config": {"index": 13, "code_hash": null, "entity": [["y_bn", "ot", 64], ["x_bn", "ot", 64], ["y_t", "ot", 32], ["x_t", "ot", 2], ["k_split", "ot", 1]]}, "result": [[0.9881527868, 0.987873416], 0, 13.430180072784424, 1612201208.0284772], "version": 0.2, "tvm_version": "0.7.dev1"}
{"input": ["cuda", "logsummulback", [256, 256, 262144, "float32"], {}], "config": {"index": 84, "code_hash": null, "entity": [["y_bn", "ot", 32], ["x_bn", "ot", 64], ["y_t", "ot", 8], ["x_t", "ot", 32], ["k_split", "ot", 1]]}, "result": [[0.07700479099999999, 0.0769873626], 0, 2.9839015007019043, 1612201209.403287], "version": 0.2, "tvm_version": "0.7.dev1"}
{"input": ["cuda", "logsummulback", [262144, 256, 256, "float32"], {}], "config": {"index": 97, "code_hash": null, "entity": [["y_bn", "ot", 64], ["x_bn", "ot", 128], ["y_t", "ot", 32], ["x_t", "ot", 32], ["k_split", "ot", 1]]}, "result": [[0.6544162456, 0.6544165278], 0, 10.515644073486328, 1612201221.9359517], "version": 0.2, "tvm_version": "0.7.dev1"}
{"input": ["cuda", "logsummulback", [262144, 256, 256, "float32"], {}], "config": {"index": 301, "code_hash": null, "entity": [["y_bn", "ot", 64], ["x_bn", "ot", 64], ["y_t", "ot", 8], ["x_t", "ot", 32], ["k_split", "ot", 8]]}, "result": [[0.5120675658, 0.5120799114000001], 0, 8.824473857879639, 1612201228.1346283], "version": 0.2, "tvm_version": "0.7.dev1"}
{"input": ["cuda", "logsummulback", [262144, 256, 256, "float32"], {}], "config": {"index": 130, "code_hash": null, "entity": [["y_bn", "ot", 64], ["x_bn", "ot", 64], ["y_t", "ot", 64], ["x_t", "ot", 2], ["k_split", "ot", 2]]}, "result": [[2.3070147676, 2.306994219], 0, 29.58580255508423, 1612201254.1059046], "version": 0.2, "tvm_version": "0.7.dev1"}
{"input": ["cuda", "logsummulback", [262144, 256, 256, "float32"], {}], "config": {"index": 407, "code_hash": null, "entity": [["y_bn", "ot", 128], ["x_bn", "ot", 32], ["y_t", "ot", 8], ["x_t", "ot", 32], ["k_split", "ot", 16]]}, "result": [[0.5384861322, 0.538495981], 0, 9.690223217010498, 1612201260.5666437], "version": 0.2, "tvm_version": "0.7.dev1"}
{"input": ["cuda", "logsummulback", [262144, 256, 256, "float32"], {}], "config": {"index": 133, "code_hash": null, "entity": [["y_bn", "ot", 64], ["x_bn", "ot", 128], ["y_t", "ot", 64], ["x_t", "ot", 2], ["k_split", "ot", 2]]}, "result": [[5.035120186, 5.036050980800001], 0, 59.036667823791504, 1612201380.236838], "version": 0.2, "tvm_version": "0.7.dev1"}
{"input": ["cuda", "logsummulback", [262144, 256, 256, "float32"], {}], "config": {"index": 262, "code_hash": null, "entity": [["y_bn", "ot", 64], ["x_bn", "ot", 32], ["y_t", "ot", 64], ["x_t", "ot", 4], ["k_split", "ot", 8]]}, "result": [[0.2650778694, 0.265084364], 0, 6.382843017578125, 1612201383.6805649], "version": 0.2, "tvm_version": "0.7.dev1"}
{"input": ["cuda", "logsummulback", [262144, 256, 256, "float32"], {}], "config": {"index": 333, "code_hash": null, "entity": [["y_bn", "ot", 32], ["x_bn", "ot", 32], ["y_t", "ot", 32], ["x_t", "ot", 2], ["k_split", "ot", 16]]}, "result": [[0.49418735180000006, 0.49423735300000005], 0, 8.622685194015503, 1612201389.6399853], "version": 0.2, "tvm_version": "0.7.dev1"}
{"input": ["cuda", "logsummulback", [262144, 256, 256, "float32"], {}], "config": {"index": 324, "code_hash": null, "entity": [["y_bn", "ot", 32], ["x_bn", "ot", 32], ["y_t", "ot", 8], ["x_t", "ot", 2], ["k_split", "ot", 16]]}, "result": [[1.8742420138, 1.874240748], 0, 24.041653156280518, 1612201410.894718], "version": 0.2, "tvm_version": "0.7.dev1"}
{"input": ["cuda", "logsummul", [256, 64, 262144, "float32"], {}], "config": {"index": 2, "code_hash": null, "entity": [["y_bn", "ot", 128], ["x_bn", "ot", 32], ["y_t", "ot", 8], ["x_t", "ot", 2], ["k_split", "ot", 1]]}, "result": [[0.2910895628, 0.2903635878], 0, 6.631656885147095, 1612201419.1230042], "version": 0.2, "tvm_version": "0.7.dev1"}
{"input": ["cuda", "logsummul", [256, 64, 262144, "float32"], {}], "config": {"index": 164, "code_hash": null, "entity": [["y_bn", "ot", 128], ["x_bn", "ot", 32], ["y_t", "ot", 8], ["x_t", "ot", 8], ["k_split", "ot", 2]]}, "result": [[0.0360265518, 0.036188613200000004], 0, 3.685849189758301, 1612201420.1623452], "version": 0.2, "tvm_version": "0.7.dev1"}
{"input": ["cuda", "logsummul", [256, 64, 262144, "float32"], {}], "config": {"index": 200, "code_hash": null, "entity": [["y_bn", "ot", 128], ["x_bn", "ot", 32], ["y_t", "ot", 32], ["x_t", "ot", 32], ["k_split", "ot", 2]]}, "result": [[0.0114150504, 0.0114070506], 0, 2.8270063400268555, 1612201420.8155851], "version": 0.2, "tvm_version": "0.7.dev1"}
{"input": ["cuda", "logsummul", [256, 64, 262144, "float32"], {}], "config": {"index": 4, "code_hash": null, "entity": [["y_bn", "ot", 64], ["x_bn", "ot", 64], ["y_t", "ot", 8], ["x_t", "ot", 2], ["k_split", "ot", 1]]}, "result": [[0.26515453, 0.26511282020000004], 0, 6.113792896270752, 1612201424.364429], "version": 0.2, "tvm_version": "0.7.dev1"}
{"input": ["cuda", "logsummul", [256, 64, 262144, "float32"], {}], "config": {"index": 326, "code_hash": null, "entity": [["y_bn", "ot", 128], ["x_bn", "ot", 32], ["y_t", "ot", 8], ["x_t", "ot", 2], ["k_split", "ot", 16]]}, "result": [[0.2020007316, 0.2019398356], 0, 5.842278480529785, 1612201427.2499735], "version": 0.2, "tvm_version": "0.7.dev1"}
{"input": ["cuda", "logsummul", [256, 64, 262144, "float32"], {}], "config": {"index": 134, "code_hash": null, "entity": [["y_bn", "ot", 128], ["x_bn", "ot", 128], ["y_t", "ot", 64], ["x_t", "ot", 2], ["k_split", "ot", 2]]}, "result": [[0.1686154216, 0.16857602359999999], 0, 4.553541421890259, 1612201432.6101656], "version": 0.2, "tvm_version": "0.7.dev1"}
{"input": ["cuda", "logsummul", [256, 64, 262144, "float32"], {}], "config": {"index": 266, "code_hash": null, "entity": [["y_bn", "ot", 128], ["x_bn", "ot", 64], ["y_t", "ot", 64], ["x_t", "ot", 4], ["k_split", "ot", 8]]}, "result": [[0.0125259758, 0.012501490200000001], 0, 3.162363290786743, 1612201433.2917714], "version": 0.2, "tvm_version": "0.7.dev1"}
{"input": ["cuda", "logsummul", [256, 64, 262144, "float32"], {}], "config": {"index": 67, "code_hash": null, "entity": [["y_bn", "ot", 64], ["x_bn", "ot", 64], ["y_t", "ot", 32], ["x_t", "ot", 8], ["k_split", "ot", 1]]}, "result": [[0.010858957800000001, 0.0108642542], 0, 2.676062822341919, 1612201433.9642425], "version": 0.2, "tvm_version": "0.7.dev1"}
{"input": ["cuda", "logsummul", [256, 64, 262144, "float32"], {}], "config": {"index": 334, "code_hash": null, "entity": [["y_bn", "ot", 64], ["x_bn", "ot", 32], ["y_t", "ot", 32], ["x_t", "ot", 2], ["k_split", "ot", 16]]}, "result": [[0.011558489, 0.011572267399999999], 0, 3.3021535873413086, 1612201434.7183502], "version": 0.2, "tvm_version": "0.7.dev1"}
{"input": ["cuda", "logsummul", [256, 64, 262144, "float32"], {}], "config": {"index": 396, "code_hash": null, "entity": [["y_bn", "ot", 32], ["x_bn", "ot", 32], ["y_t", "ot", 64], ["x_t", "ot", 8], ["k_split", "ot", 16]]}, "result": [[0.1181859318, 0.1181437276], 0, 4.109425067901611, 1612201436.554602], "version": 0.2, "tvm_version": "0.7.dev1"}
{"input": ["cuda", "logsummulback", [256, 64, 262144, "float32"], {}], "config": {"index": 234, "code_hash": null, "entity": [["y_bn", "ot", 32], ["x_bn", "ot", 32], ["y_t", "ot", 64], ["x_t", "ot", 2], ["k_split", "ot", 8]]}, "result": [[0.1556115252, 0.1564510188], 0, 5.08994722366333, 1612201443.744413], "version": 0.2, "tvm_version": "0.7.dev1"}
{"input": ["cuda", "logsummulback", [256, 64, 262144, "float32"], {}], "config": {"index": 414, "code_hash": null, "entity": [["y_bn", "ot", 32], ["x_bn", "ot", 32], ["y_t", "ot", 32], ["x_t", "ot", 32], ["k_split", "ot", 16]]}, "result": [[0.0153160834, 0.015275528799999999], 0, 4.275891304016113, 1612201444.441802], "version": 0.2, "tvm_version": "0.7.dev1"}
{"input": ["cuda", "logsummulback", [256, 64, 262144, "float32"], {}], "config": {"index": 84, "code_hash": null, "entity": [["y_bn", "ot", 32], ["x_bn", "ot", 64], ["y_t", "ot", 8], ["x_t", "ot", 32], ["k_split", "ot", 1]]}, "result": [[0.019377061600000002, 0.019380919599999998], 0, 4.035196542739868, 1612201445.2116373], "version": 0.2, "tvm_version": "0.7.dev1"}
{"input": ["cuda", "logsummulback", [256, 64, 262144, "float32"], {}], "config": {"index": 326, "code_hash": null, "entity": [["y_bn", "ot", 128], ["x_bn", "ot", 32], ["y_t", "ot", 8], ["x_t", "ot", 2], ["k_split", "ot", 16]]}, "result": [[0.5633080326, 0.5645203839999999], 0, 10.691612482070923, 1612201452.0372987], "version": 0.2, "tvm_version": "0.7.dev1"}
{"input": ["cuda", "logsummulback", [256, 64, 262144, "float32"], {}], "config": {"index": 75, "code_hash": null, "entity": [["y_bn", "ot", 32], ["x_bn", "ot", 64], ["y_t", "ot", 64], ["x_t", "ot", 8], ["k_split", "ot", 1]]}, "result": [[0.1373558104, 0.1373420296], 0, 4.85121750831604, 1612201454.1109807], "version": 0.2, "tvm_version": "0.7.dev1"}
{"input": ["cuda", "logsummulback", [256, 64, 262144, "float32"], {}], "config": {"index": 112, "code_hash": null, "entity": [["y_bn", "ot", 64], ["x_bn", "ot", 64], ["y_t", "ot", 8], ["x_t", "ot", 2], ["k_split", "ot", 2]]}, "result": [[0.3199364358, 0.319887397], 0, 6.025529623031616, 1612201460.7752645], "version": 0.2, "tvm_version": "0.7.dev1"}
{"input": ["cuda", "logsummulback", [256, 64, 262144, "float32"], {}], "config": {"index": 353, "code_hash": null, "entity": [["y_bn", "ot", 128], ["x_bn", "ot", 32], ["y_t", "ot", 8], ["x_t", "ot", 4], ["k_split", "ot", 16]]}, "result": [[0.2971581246, 0.2974455876], 0, 6.152532339096069, 1612201464.6367085], "version": 0.2, "tvm_version": "0.7.dev1"}
{"input": ["cuda", "logsummulback", [256, 64, 262144, "float32"], {}], "config": {"index": 273, "code_hash": null, "entity": [["y_bn", "ot", 32], ["x_bn", "ot", 64], ["y_t", "ot", 8], ["x_t", "ot", 8], ["k_split", "ot", 8]]}, "result": [[0.026694891999999998, 0.0266833786], 0, 3.1250181198120117, 1612201465.4723687], "version": 0.2, "tvm_version": "0.7.dev1"}
{"input": ["cuda", "logsummulback", [262144, 64, 256, "float32"], {}], "config": {"index": 202, "code_hash": null, "entity": [["y_bn", "ot", 64], ["x_bn", "ot", 64], ["y_t", "ot", 32], ["x_t", "ot", 32], ["k_split", "ot", 2]]}, "result": [[0.30360762480000003, 0.30360395640000004], 0, 5.444111108779907, 1612201533.383195], "version": 0.2, "tvm_version": "0.7.dev1"}
{"input": ["cuda", "logsummulback", [262144, 64, 256, "float32"], {}], "config": {"index": 39, "code_hash": null, "entity": [["y_bn", "ot", 32], ["x_bn", "ot", 64], ["y_t", "ot", 32], ["x_t", "ot", 4], ["k_split", "ot", 1]]}, "result": [[0.7046452994, 0.7046492226], 0, 10.476417303085327, 1612201541.6865845], "version": 0.2, "tvm_version": "0.7.dev1"}
{"input": ["cuda", "logsummulback", [262144, 64, 256, "float32"], {}], "config": {"index": 231, "code_hash": null, "entity": [["y_bn", "ot", 32], ["x_bn", "ot", 128], ["y_t", "ot", 32], ["x_t", "ot", 2], ["k_split", "ot", 8]]}, "result": [[5.2456261390000005, 5.2543023602], 0, 61.89476203918457, 1612201604.1471956], "version": 0.2, "tvm_version": "0.7.dev1"}
{"input": ["cuda", "logsummulback", [262144, 64, 256, "float32"], {}], "config": {"index": 281, "code_hash": null, "entity": [["y_bn", "ot", 128], ["x_bn", "ot", 32], ["y_t", "ot", 32], ["x_t", "ot", 8], ["k_split", "ot", 8]]}, "result": [[0.49694840840000004, 0.49694844720000003], 0, 9.116621017456055, 1612201610.1451738], "version": 0.2, "tvm_version": "0.7.dev1"}
{"input": ["cuda", "logsummulback", [262144, 64, 256, "float32"], {}], "config": {"index": 421, "code_hash": null, "entity": [["y_bn", "ot", 64], ["x_bn", "ot", 128], ["y_t", "ot", 32], ["x_t", "ot", 32], ["k_split", "ot", 16]]}, "result": [[0.487740302, 0.4877475476], 0, 8.462890863418579, 1612201676.4687495], "version": 0.2, "tvm_version": "0.7.dev1"}
{"input": ["cuda", "logsummulback", [262144, 64, 256, "float32"], {}], "config": {"index": 13, "code_hash": null, "entity": [["y_bn", "ot", 64], ["x_bn", "ot", 64], ["y_t", "ot", 32], ["x_t", "ot", 2], ["k_split", "ot", 1]]}, "result": [[3.2807238148000004, 3.2807068571999998], 0, 39.3272123336792, 1612201713.1142738], "version": 0.2, "tvm_version": "0.7.dev1"}
{"input": ["cuda", "logsummul", [256, 128, 262144, "float32"], {}], "config": {"index": 346, "code_hash": null, "entity": [["y_bn", "ot", 64], ["x_bn", "ot", 64], ["y_t", "ot", 64], ["x_t", "ot", 2], ["k_split", "ot", 16]]}, "result": [[0.0313073344, 0.026273896400000003], 0, 3.821607828140259, 1612201718.6162703], "version": 0.2, "tvm_version": "0.7.dev1"}
{"input": ["cuda", "logsummul", [256, 128, 262144, "float32"], {}], "config": {"index": 224, "code_hash": null, "entity": [["y_bn", "ot", 128], ["x_bn", "ot", 128], ["y_t", "ot", 8], ["x_t", "ot", 2], ["k_split", "ot", 8]]}, "result": [[0.471060465, 0.4712160848], 0, 8.428706884384155, 1612201724.5618727], "version": 0.2, "tvm_version": "0.7.dev1"}
{"input": ["cuda", "logsummul", [256, 128, 262144, "float32"], {}], "config": {"index": 44, "code_hash": null, "entity": [["y_bn", "ot", 128], ["x_bn", "ot", 128], ["y_t", "ot", 32], ["x_t", "ot", 4], ["k_split", "ot", 1]]}, "result": [[0.3056750784, 0.3055004402], 0, 7.268343210220337, 1612201728.743049], "version": 0.2, "tvm_version": "0.7.dev1"}
{"input": ["cuda", "logsummul", [256, 128, 262144, "float32"], {}], "config": {"index": 223, "code_hash": null, "entity": [["y_bn", "ot", 64], ["x_bn", "ot", 128], ["y_t", "ot", 8], ["x_t", "ot", 2], ["k_split", "ot", 8]]}, "result": [[0.4455480388, 0.4456509098], 0, 8.41423773765564, 1612201734.4727056], "version": 0.2, "tvm_version": "0.7.dev1"}
{"input": ["cuda", "logsummul", [256, 128, 262144, "float32"], {}], "config": {"index": 299, "code_hash": null, "entity": [["y_bn", "ot", 128], ["x_bn", "ot", 32], ["y_t", "ot", 8], ["x_t", "ot", 32], ["k_split", "ot", 8]]}, "result": [[0.0121841562, 0.012189886399999999], 0, 3.534980535507202, 1612201735.1659436], "version": 0.2, "tvm_version": "0.7.dev1"}
{"input": ["cuda", "logsummul", [256, 128, 262144, "float32"], {}], "config": {"index": 127, "code_hash": null, "entity": [["y_bn", "ot", 64], ["x_bn", "ot", 32], ["y_t", "ot", 64], ["x_t", "ot", 2], ["k_split", "ot", 2]]}, "result": [[0.0240173818, 0.0181199782], 0, 2.555361270904541, 1612201738.520465], "version": 0.2, "tvm_version": "0.7.dev1"}
{"input": ["cuda", "logsummul", [256, 128, 262144, "float32"], {}], "config": {"index": 120, "code_hash": null, "entity": [["y_bn", "ot", 32], ["x_bn", "ot", 64], ["y_t", "ot", 32], ["x_t", "ot", 2], ["k_split", "ot", 2]]}, "result": [[0.019924808, 0.0198651226], 0, 3.1731348037719727, 1612201739.277824], "version": 0.2, "tvm_version": "0.7.dev1"}
{"input": ["cuda", "logsummul", [256, 128, 262144, "float32"], {}], "config": {"index": 306, "code_hash": null, "entity": [["y_bn", "ot", 32], ["x_bn", "ot", 32], ["y_t", "ot", 32], ["x_t", "ot", 32], ["k_split", "ot", 8]]}, "result": [[0.0261621694, 0.026145069599999998], 0, 2.7713611125946045, 1612201740.0879548], "version": 0.2, "tvm_version": "0.7.dev1"}
{"input": ["cuda", "logsummul", [256, 128, 262144, "float32"], {}], "config": {"index": 270, "code_hash": null, "entity": [["y_bn", "ot", 32], ["x_bn", "ot", 32], ["y_t", "ot", 8], ["x_t", "ot", 8], ["k_split", "ot", 8]]}, "result": [[0.025319820399999998, 0.025311083], 0, 3.1345319747924805, 1612201740.9332843], "version": 0.2, "tvm_version": "0.7.dev1"}
{"input": ["cuda", "logsummul", [256, 128, 262144, "float32"], {}], "config": {"index": 24, "code_hash": null, "entity": [["y_bn", "ot", 32], ["x_bn", "ot", 128], ["y_t", "ot", 64], ["x_t", "ot", 2], ["k_split", "ot", 1]]}, "result": [[0.9785831098, 0.9797586644], 0, 13.73313045501709, 1612201752.3056161], "version": 0.2, "tvm_version": "0.7.dev1"}
{"input": ["cuda", "logsummulback", [256, 128, 262144, "float32"], {}], "config": {"index": 357, "code_hash": null, "entity": [["y_bn", "ot", 32], ["x_bn", "ot", 128], ["y_t", "ot", 8], ["x_t", "ot", 4], ["k_split", "ot", 16]]}, "result": [[0.2819024868, 0.2818872314], 0, 6.7775232791900635, 1612201760.3174121], "version": 0.2, "tvm_version": "0.7.dev1"}
{"input": ["cuda", "logsummulback", [256, 128, 262144, "float32"], {}], "config": {"index": 7, "code_hash": null, "entity": [["y_bn", "ot", 64], ["x_bn", "ot", 128], ["y_t", "ot", 8], ["x_t", "ot", 2], ["k_split", "ot", 1]]}, "result": [[1.681448257, 1.6812584548], 0, 22.287761926651, 1612201779.4857764], "version": 0.2, "tvm_version": "0.7.dev1"}
{"input": ["cuda", "logsummulback", [256, 128, 262144, "float32"], {}], "config": {"index": 407, "code_hash": null, "entity": [["y_bn", "ot", 128], ["x_bn", "ot", 32], ["y_t", "ot", 8], ["x_t", "ot", 32], ["k_split", "ot", 16]]}, "result": [[0.060644388199999996, 0.060624496400000005], 0, 4.025096416473389, 1612201781.3111877], "version": 0.2, "tvm_version": "0.7.dev1"}
{"input": ["cuda", "logsummulback", [256, 128, 262144, "float32"], {}], "config": {"index": 378, "code_hash": null, "entity": [["y_bn", "ot", 32], ["x_bn", "ot", 32], ["y_t", "ot", 8], ["x_t", "ot", 8], ["k_split", "ot", 16]]}, "result": [[0.0465065302, 0.044900864], 0, 3.545248508453369, 1612201785.4403965], "version": 0.2, "tvm_version": "0.7.dev1"}
{"input": ["cuda", "logsummulback", [256, 128, 262144, "float32"], {}], "config": {"index": 249, "code_hash": null, "entity": [["y_bn", "ot", 32], ["x_bn", "ot", 128], ["y_t", "ot", 8], ["x_t", "ot", 4], ["k_split", "ot", 8]]}, "result": [[0.28385829500000004, 0.2837664104], 0, 6.816667556762695, 1612201789.3325953], "version": 0.2, "tvm_version": "0.7.dev1"}
{"input": ["cuda", "logsummulback", [256, 128, 262144, "float32"], {}], "config": {"index": 408, "code_hash": null, "entity": [["y_bn", "ot", 32], ["x_bn", "ot", 64], ["y_t", "ot", 8], ["x_t", "ot", 32], ["k_split", "ot", 16]]}, "result": [[0.0249162732, 0.0250943032], 0, 3.285261631011963, 1612201790.1197963], "version": 0.2, "tvm_version": "0.7.dev1"}
{"input": ["cuda", "logsummulback", [256, 128, 262144, "float32"], {}], "config": {"index": 225, "code_hash": null, "entity": [["y_bn", "ot", 32], ["x_bn", "ot", 32], ["y_t", "ot", 32], ["x_t", "ot", 2], ["k_split", "ot", 8]]}, "result": [[0.034393727, 0.034349749], 0, 3.6878445148468018, 1612201791.0563397], "version": 0.2, "tvm_version": "0.7.dev1"}
{"input": ["cuda", "logsummulback", [262144, 128, 256, "float32"], {}], "config": {"index": 362, "code_hash": null, "entity": [["y_bn", "ot", 128], ["x_bn", "ot", 32], ["y_t", "ot", 32], ["x_t", "ot", 4], ["k_split", "ot", 16]]}, "result": [[0.9874027935999999, 0.9873754328000001], 0, 14.151857852935791, 1612201807.005207], "version": 0.2, "tvm_version": "0.7.dev1"}
{"input": ["cuda", "logsummulback", [262144, 128, 256, "float32"], {}], "config": {"index": 276, "code_hash": null, "entity": [["y_bn", "ot", 32], ["x_bn", "ot", 128], ["y_t", "ot", 8], ["x_t", "ot", 8], ["k_split", "ot", 8]]}, "result": [[2.1857784444, 2.1857057504], 0, 27.638343811035156, 1612201831.6622612], "version": 0.2, "tvm_version": "0.7.dev1"}
{"input": ["cuda", "logsummulback", [262144, 128, 256, "float32"], {}], "config": {"index": 84, "code_hash": null, "entity": [["y_bn", "ot", 32], ["x_bn", "ot", 64], ["y_t", "ot", 8], ["x_t", "ot", 32], ["k_split", "ot", 1]]}, "result": [[0.3686618426, 0.3686803172], 0, 7.238595247268677, 1612201836.2354522], "version": 0.2, "tvm_version": "0.7.dev1"}
{"input": ["cuda", "logsummulback", [262144, 128, 256, "float32"], {}], "config": {"index": 272, "code_hash": null, "entity": [["y_bn", "ot", 128], ["x_bn", "ot", 32], ["y_t", "ot", 8], ["x_t", "ot", 8], ["k_split", "ot", 8]]}, "result": [[2.0109296100000003, 2.0110255223999998], 0, 25.46369218826294, 1612201922.5262113], "version": 0.2, "tvm_version": "0.7.dev1"}
{"input": ["cuda", "logsummulback", [262144, 128, 256, "float32"], {}], "config": {"index": 165, "code_hash": null, "entity": [["y_bn", "ot", 32], ["x_bn", "ot", 64], ["y_t", "ot", 8], ["x_t", "ot", 8], ["k_split", "ot", 2]]}, "result": [[1.056790373, 1.0567872102], 0, 14.741451740264893, 1612201934.7215593], "version": 0.2, "tvm_version": "0.7.dev1"}
{"input": ["cuda", "logsummulback", [262144, 128, 256, "float32"], {}], "config": {"index": 264, "code_hash": null, "entity": [["y_bn", "ot", 32], ["x_bn", "ot", 64], ["y_t", "ot", 64], ["x_t", "ot", 4], ["k_split", "ot", 8]]}, "result": [[0.8459292204000001, 0.8458332373999999], 0, 12.709833860397339, 1612201944.5355766], "version": 0.2, "tvm_version": "0.7.dev1"}
{"input": ["cuda", "logsummulback", [262144, 128, 256, "float32"], {}], "config": {"index": 63, "code_hash": null, "entity": [["y_bn", "ot", 32], ["x_bn", "ot", 32], ["y_t", "ot", 32], ["x_t", "ot", 8], ["k_split", "ot", 1]]}, "result": [[0.22149836239999998, 0.221481693], 0, 5.775829315185547, 1612201947.496605], "version": 0.2, "tvm_version": "0.7.dev1"}
{"input": ["cuda", "logsummul", [256, 64, 4096, "float32"], {}], "config": {"index": 61, "code_hash": null, "entity": [["y_bn", "ot", 64], ["x_bn", "ot", 128], ["y_t", "ot", 8], ["x_t", "ot", 8], ["k_split", "ot", 1]]}, "result": [[0.003313918, 0.003293839875], 0, 2.605309009552002, 1612201951.6867805], "version": 0.2, "tvm_version": "0.7.dev1"}
{"input": ["cuda", "logsummul", [256, 64, 4096, "float32"], {}], "config": {"index": 69, "code_hash": null, "entity": [["y_bn", "ot", 32], ["x_bn", "ot", 128], ["y_t", "ot", 32], ["x_t", "ot", 8], ["k_split", "ot", 1]]}, "result": [[0.00046525909259259254, 0.0004650977962962963], 0, 1.6985206604003906, 1612201952.338364], "version": 0.2, "tvm_version": "0.7.dev1"}
{"input": ["cuda", "logsummul", [256, 64, 4096, "float32"], {}], "config": {"index": 329, "code_hash": null, "entity": [["y_bn", "ot", 128], ["x_bn", "ot", 64], ["y_t", "ot", 8], ["x_t", "ot", 2], ["k_split", "ot", 16]]}, "result": [[0.0056608395555555555, 0.005668430111111111], 0, 2.5906264781951904, 1612201953.1093838], "version": 0.2, "tvm_version": "0.7.dev1"}
{"input": ["cuda", "logsummul", [256, 64, 4096, "float32"], {}], "config": {"index": 0, "code_hash": null, "entity": [["y_bn", "ot", 32], ["x_bn", "ot", 32], ["y_t", "ot", 8], ["x_t", "ot", 2], ["k_split", "ot", 1]]}, "result": [[0.002489138761904762, 0.0024973015714285715], 0, 2.865539073944092, 1612201956.1668286], "version": 0.2, "tvm_version": "0.7.dev1"}
{"input": ["cuda", "logsummul", [256, 64, 4096, "float32"], {}], "config": {"index": 238, "code_hash": null, "entity": [["y_bn", "ot", 64], ["x_bn", "ot", 64], ["y_t", "ot", 64], ["x_t", "ot", 2], ["k_split", "ot", 8]]}, "result": [[0.0003746855373134328, 0.00037620035074626865], 0, 1.9381422996520996, 1612201956.7956128], "version": 0.2, "tvm_version": "0.7.dev1"}
{"input": ["cuda", "logsummul", [256, 64, 4096, "float32"], {}], "config": {"index": 201, "code_hash": null, "entity": [["y_bn", "ot", 32], ["x_bn", "ot", 64], ["y_t", "ot", 32], ["x_t", "ot", 32], ["k_split", "ot", 2]]}, "result": [[0.000342333, 0.0003336094829059829], 0, 2.546463966369629, 1612201957.5240939], "version": 0.2, "tvm_version": "0.7.dev1"}
{"input": ["cuda", "logsummul", [256, 64, 4096, "float32"], {}], "config": {"index": 37, "code_hash": null, "entity": [["y_bn", "ot", 64], ["x_bn", "ot", 32], ["y_t", "ot", 32], ["x_t", "ot", 4], ["k_split", "ot", 1]]}, "result": [[0.0001964696921182266, 0.0001964019236453202], 0, 2.5284583568573, 1612201958.2865653], "version": 0.2, "tvm_version": "0.7.dev1"}
{"input": ["cuda", "logsummulback", [256, 64, 4096, "float32"], {}], "config": {"index": 272, "code_hash": null, "entity": [["y_bn", "ot", 128], ["x_bn", "ot", 32], ["y_t", "ot", 8], ["x_t", "ot", 8], ["k_split", "ot", 8]]}, "result": [[0.0027500205263157897, 0.002749986684210526], 0, 3.6878018379211426, 1612201963.0103326], "version": 0.2, "tvm_version": "0.7.dev1"}
{"input": ["cuda", "logsummulback", [256, 64, 4096, "float32"], {}], "config": {"index": 147, "code_hash": null, "entity": [["y_bn", "ot", 32], ["x_bn", "ot", 64], ["y_t", "ot", 32], ["x_t", "ot", 4], ["k_split", "ot", 2]]}, "result": [[0.00097317925, 0.000982875653846154], 0, 3.4909236431121826, 1612201963.6238654], "version": 0.2, "tvm_version": "0.7.dev1"}
{"input": ["cuda", "logsummulback", [256, 64, 4096, "float32"], {}], "config": {"index": 9, "code_hash": null, "entity": [["y_bn", "ot", 32], ["x_bn", "ot", 32], ["y_t", "ot", 32], ["x_t", "ot", 2], ["k_split", "ot", 1]]}, "result": [[0.0012847440256410258, 0.0012670171428571428], 0, 3.3983101844787598, 1612201964.345471], "version": 0.2, "tvm_version": "0.7.dev1"}
{"input": ["cuda", "logsummulback", [256, 64, 4096, "float32"], {}], "config": {"index": 225, "code_hash": null, "entity": [["y_bn", "ot", 32], ["x_bn", "ot", 32], ["y_t", "ot", 32], ["x_t", "ot", 2], ["k_split", "ot", 8]]}, "result": [[0.0005374580466666666, 0.00053719084], 0, 3.256244421005249, 1612201965.0982351], "version": 0.2, "tvm_version": "0.7.dev1"}
{"input": ["cuda", "logsummulback", [256, 64, 4096, "float32"], {}], "config": {"index": 191, "code_hash": null, "entity": [["y_bn", "ot", 128], ["x_bn", "ot", 32], ["y_t", "ot", 8], ["x_t", "ot", 32], ["k_split", "ot", 2]]}, "result": [[0.0009674130769230769, 0.0009656125384615385], 0, 2.2370431423187256, 1612201968.0720005], "version": 0.2, "tvm_version": "0.7.dev1"}
{"input": ["cuda", "logsummulback", [256, 64, 4096, "float32"], {}], "config": {"index": 281, "code_hash": null, "entity": [["y_bn", "ot", 128], ["x_bn", "ot", 32], ["y_t", "ot", 32], ["x_t", "ot", 8], ["k_split", "ot", 8]]}, "result": [[0.0005304704802631579, 0.000524010677631579], 0, 2.8389480113983154, 1612201968.7835767], "version": 0.2, "tvm_version": "0.7.dev1"}
{"input": ["cuda", "logsummulback", [256, 64, 4096, "float32"], {}], "config": {"index": 38, "code_hash": null, "entity": [["y_bn", "ot", 128], ["x_bn", "ot", 32], ["y_t", "ot", 32], ["x_t", "ot", 4], ["k_split", "ot", 1]]}, "result": [[0.001924048653846154, 0.0019242344615384617], 0, 2.763104200363159, 1612201969.4168007], "version": 0.2, "tvm_version": "0.7.dev1"}
{"input": ["cuda", "logsummulback", [4096, 64, 256, "float32"], {}], "config": {"index": 387, "code_hash": null, "entity": [["y_bn", "ot", 32], ["x_bn", "ot", 32], ["y_t", "ot", 32], ["x_t", "ot", 8], ["k_split", "ot", 16]]}, "result": [[0.002903940111111111, 0.002368727407407407], 0, 4.490864992141724, 1612201975.0408297], "version": 0.2, "tvm_version": "0.7.dev1"}
{"input": ["cuda", "logsummulback", [4096, 64, 256, "float32"], {}], "config": {"index": 360, "code_hash": null, "entity": [["y_bn", "ot", 32], ["x_bn", "ot", 32], ["y_t", "ot", 32], ["x_t", "ot", 4], ["k_split", "ot", 16]]}, "result": [[0.0038289247857142858, 0.003828748285714286], 0, 3.247175455093384, 1612201975.6881728], "version": 0.2, "tvm_version": "0.7.dev1"}
